### ISSUE TITLE
failed to assign ip when macvlan + dhcp

### ISSUE THREAD

**Issue by yuchunyun** [containernetworking/plugins#371]
failed to assign ip when macvlan + dhcp，the following are error info:
1：run a container
docker run --net=none -dt busybox
docker inspect -f '{{ .State.Pid }}' 548ddf0ac39c97e30687d7f8ed90d4ec357a482ade89d2248719ea27b074c614

export CNI_COMMAND=ADD;export CNI_IFNAME=eth0;export CNI_PATH=/opt/cni/bin/
export CNI_CONTAINERID=548ddf0ac39c97e30687d7f8ed90d4ec357a482ade89d2248719ea27b074c614
export CNI_NETNS=/proc/23217/ns/net 

2：Assign IP using CNI
/opt/cni/bin/macvlan < ./net2.conf 
{
    "code": 100,
    "msg": "error calling DHCP.Allocate: no more tries"
}

cat net2.conf 
{
    "name": "macvlannet",
    "type": "macvlan",  
    "master": "ens3",
    "ipam": {     
        "type": "dhcp"
    }
}
3： DHCP Daemon log
./dhcp daemon    
2019/08/14 17:35:35 548ddf0ac39c97e30687d7f8ed90d4ec357a482ade89d2248719ea27b074c614/macvlannet: acquiring lease
2019/08/14 17:35:35 Link "eth0" down. Attempting to set up
2019/08/14 17:35:35 network is down
2019/08/14 17:35:45 resource temporarily unavailable
2019/08/14 17:35:58 resource temporarily unavailable

4：DHCP Server trafic
 tcpdump -i ens3 port 67
tcpdump: verbose output suppressed, use -v or -vv for full protocol decode
listening on ens3, link-type EN10MB (Ethernet), capture size 262144 bytes
17:35:40.091132 IP 0.0.0.0.bootpc > 255.255.255.255.bootps: BOOTP/DHCP, Request from 8e:a7:13:f7:a2:cc (oui Unknown), length 272
17:35:41.093168 IP k8s02-01.bootps > 202.173.9.90.bootpc: BOOTP/DHCP, Reply, length 300
17:35:52.886683 IP 0.0.0.0.bootpc > 255.255.255.255.bootps: BOOTP/DHCP, Request from 8e:a7:13:f7:a2:cc (oui Unknown), length 272
17:35:52.887037 IP k8s02-01.bootps > 202.173.9.90.bootpc: BOOTP/DHCP, Reply, length 300

from dhcp server, seems dhcp server can send response from request, but dhcp dameon can't get.
I find many people have this problem. Is it a BUG?

**Comment by gongxiao2** [comment]
Is this problem solved now?
