### ISSUE TITLE
Drop invalid conntrack packets

### ISSUE THREAD

**Issue by mccv1r0** [containernetworking/plugins#816]
After RST is seen in either direction, conntrack fails to masquerade any packets in flight in the other direction.  This leaks the internal IP address used.  Users are not happy about it. 

```
  462   5.788126 server_ip → client_ip TLSv1.2 90 Application Data
  463   5.788207 server_ip → client_ip TCP 66 443 → 45020 [FIN, ACK] Seq=3664 Ack=763 Win=31104 Len=0 TSval=675936350 TSecr=3317842872
  464   5.788447 client_ip → server_ip TLSv1.2 90 Application Data
  465   5.788479 client_ip → server_ip TCP 66 45020 → 443 [RST, ACK] Seq=787 Ack=3665 Win=39040 Len=0 TSval=3317842889 TSecr=675936350  <----- RST
  466   5.788581    10.88.0.8 → client_ip TCP 54 8443 → 45020 [RST] Seq=1 Win=0 Len=0   <------ leak
```
